title,provider,source_type,category,province,district,region,money_type,age_min,age_max,target,summary,url,matched_reason,score
달서청년 자격증 응시료 지원사업,대구광역시 달서구,공공기관,취업,대구,달서구,대구 달서구,비용지원,18,39,달서구 거주 미취업 청년,어학 한국사 국가자격시험 응시료를 1인당 연 1회 최대 10만원까지 지원하는 사업입니다.,https://www.dalseo.daegu.kr,,0
서울 청년수당,서울특별시,공공기관,생활지원,서울,,서울,현금/수당,19,34,서울 거주 미취업 청년,서울 거주 미취업 청년의 진로 탐색과 구직 활동을 위해 활동지원금을 지급합니다.,https://youth.seoul.go.kr,,0
경기도 청년기본소득,경기도,공공기관,생활지원,경기,,경기,지역화폐,24,24,경기도 청년,경기도 거주 청년에게 분기별 지역화폐를 지급하는 청년 지원 정책입니다.,https://youth.gg.go.kr,,0
청년월세 한시 특별지원,국토교통부,공공기관,주거,전국,,전국,비용지원,19,34,무주택 청년,청년층 주거비 부담을 줄이기 위해 월세를 한시적으로 지원하는 제도입니다.,https://www.bokjiro.go.kr,,0
청년내일저축계좌,보건복지부,공공기관,금융,전국,,전국,금융지원,19,34,일하는 청년,근로 중인 청년이 자산을 형성할 수 있도록 정부가 저축액을 지원하는 정책입니다.,https://www.bokjiro.go.kr,,0
국민취업지원제도,고용노동부,공공기관,취업,전국,,전국,현금/수당,15,34,구직중 청년,구직자에게 취업지원서비스와 구직촉진수당 등 소득지원을 함께 제공하는 고용 지원 제도입니다.,https://www.kua.go.kr,,0
청년도약계좌,금융위원회,공공기관,금융,전국,,전국,금융지원,19,34,청년,청년의 중장기 자산 형성을 돕기 위한 정책형 금융상품입니다.,https://ylaccount.kinfa.or.kr,,0
청년문화예술패스,문화체육관광부,공공기관,문화,전국,,전국,바우처/포인트,19,19,청년,청년의 공연과 전시 관람 기회를 확대하기 위한 문화예술 관람비 지원 정책입니다.,https://www.mcst.go.kr,,0
